{
  "run_id": "large_mf_16t_baseline",
  "slurm_id": "41703864",
  "label": "large_mf_16t",
  "description": "CPU baseline: large_modelfinder.fa @ 16T, ModelFinder \u2192 F81+F+G4 chosen according to BIC, MF=1750s",
  "run_type": "cpu_baseline",
  "timing": [
    {
      "command": "iqtree3 -s large_modelfinder.fa -T 16 -seed 1",
      "time_s": 2734,
      "memory_kb": 0
    }
  ],
  "verify": [],
  "env": {
    "hostname": "setonix-node",
    "date": "2026-04-19T21:24:31+08:00",
    "run_id": "41703864",
    "cpu": "AMD EPYC 7763 64-Core Processor",
    "cores": "16",
    "gcc": "gcc (SUSE Linux) 14.3.0",
    "rocm": "N/A (CPU-only baseline)"
  },
  "gpu_info": "",
  "profile": {
    "run_id": "41703864",
    "dataset": "large_modelfinder.fa",
    "threads": 16,
    "metrics": {
      "cycles": 150536470714385,
      "instructions": 112412709968964,
      "cache-references": 6554221120830,
      "cache-misses": 617603035352,
      "branch-instructions": 12083306209139,
      "branch-misses": 2651331676,
      "L1-dcache-loads": 50385736664166,
      "L1-dcache-load-misses": 3728131803894,
      "stalled-cycles-frontend": 1147388807480,
      "IPC": 0.747,
      "cache-miss-rate": 9.42,
      "branch-miss-rate": 0.0219,
      "L1-dcache-miss-rate": 7.4,
      "frontend-stall-rate": 0.76
    },
    "perf_cmd": "/scratch/pawsey1351/asamuel/iqtree3/build-profiling/iqtree3 -s /scratch/pawsey1351/asamuel/iqtree3/benchmarks/large_modelfinder.fa -T 16 -seed 1 --prefix /scratch/pawsey1351/asamuel/iqtree3/setonix-ci/profiles/large_mf_16t_41703864/iqtree_run"
  },
  "modelfinder": {
    "model_selected": "F81+F+G4",
    "wall_time_s": 1750.142,
    "best_model_bic": "F81+F+G4",
    "log_likelihood": -2996714.5769,
    "unconstrained_log_likelihood": -535546.706,
    "gamma_alpha": 0.9995,
    "tree_length": 21.6595,
    "bic": 5995603.9293,
    "aic": 5993831.1539,
    "aicc": 5993832.7845,
    "candidates": [
      {
        "model": "F81+F+G4",
        "log_likelihood": -2996714.577,
        "aic": 5993831.154,
        "aic_weight": 0.000255,
        "aicc": 5993832.785,
        "aicc_weight": 0.000265,
        "bic": 5995603.929,
        "bic_weight": 0.98
      },
      {
        "model": "TPM2u+F+G4",
        "log_likelihood": -2996708.746,
        "aic": 5993823.492,
        "aic_weight": 0.0118,
        "aicc": 5993825.155,
        "aicc_weight": 0.012,
        "bic": 5995613.907,
        "bic_weight": 0.00667
      },
      {
        "model": "HKY+F+G4",
        "log_likelihood": -2996714.361,
        "aic": 5993832.722,
        "aic_weight": 0.000117,
        "aicc": 5993834.369,
        "aicc_weight": 0.00012,
        "bic": 5995614.317,
        "bic_weight": 0.00544
      },
      {
        "model": "TN+F+G4",
        "log_likelihood": -2996709.47,
        "aic": 5993824.94,
        "aic_weight": 0.00571,
        "aicc": 5993826.603,
        "aicc_weight": 0.00583,
        "bic": 5995615.355,
        "bic_weight": 0.00324
      },
      {
        "model": "TIM2+F+G4",
        "log_likelihood": -2996704.066,
        "aic": 5993816.132,
        "aic_weight": 0.467,
        "aicc": 5993817.812,
        "aicc_weight": 0.473,
        "bic": 5995615.367,
        "bic_weight": 0.00322
      },
      {
        "model": "F81+F+I+G4",
        "log_likelihood": -2996715.575,
        "aic": 5993835.15,
        "aic_weight": 3.46e-05,
        "aicc": 5993836.797,
        "aicc_weight": 3.56e-05,
        "bic": 5995616.745,
        "bic_weight": 0.00161
      },
      {
        "model": "K3Pu+F+G4",
        "log_likelihood": -2996712.901,
        "aic": 5993831.802,
        "aic_weight": 0.000185,
        "aicc": 5993833.465,
        "aicc_weight": 0.000189,
        "bic": 5995622.217,
        "bic_weight": 0.000105
      },
      {
        "model": "TIM+F+G4",
        "log_likelihood": -2996708.054,
        "aic": 5993824.108,
        "aic_weight": 0.00865,
        "aicc": 5993825.788,
        "aicc_weight": 0.00876,
        "bic": 5995623.343,
        "bic_weight": 5.96e-05
      },
      {
        "model": "TPM3u+F+G4",
        "log_likelihood": -2996713.646,
        "aic": 5993833.292,
        "aic_weight": 8.77e-05,
        "aicc": 5993834.955,
        "aicc_weight": 8.95e-05,
        "bic": 5995623.707,
        "bic_weight": 4.97e-05
      },
      {
        "model": "TIM3+F+G4",
        "log_likelihood": -2996708.736,
        "aic": 5993825.472,
        "aic_weight": 0.00437,
        "aicc": 5993827.152,
        "aicc_weight": 0.00443,
        "bic": 5995624.707,
        "bic_weight": 3.01e-05
      }
    ]
  },
  "summary": {
    "pass": 0,
    "fail": 0,
    "total_time": 2734,
    "all_pass": true,
    "wall_time": "0h45m34s"
  },
  "dataset_info": {
    "file": "large_modelfinder.fa",
    "file_size_bytes": 5001200,
    "fasta_taxa": 100,
    "fasta_sites": 50000,
    "taxa": 100,
    "sites": 50000,
    "patterns": 48293,
    "constant_sites": 679,
    "invariant_sites": 679,
    "informative_sites": 47776,
    "sequence_type": "DNA",
    "dataset_canonical": false,
    "dataset_canonical_note": "Dataset was generated with a different IQ-TREE version or seed than the canonical Gadi benchmark (large_modelfinder.fa). patterns=48293 vs canonical 45386. This run should be re-executed against the canonical file for cross-platform comparisons to be valid."
  }
}