{
  "run_id": "large_modelfinder_64t_smtoff_pin",
  "slurm_id": "42179044",
  "label": "large_modelfinder_64t_smtoff_pin",
  "run_type": "deep_profile",
  "timing": [],
  "verify": [],
  "env": {
    "run_id": "42179044",
    "label": "large_modelfinder_64t_smtoff_pin",
    "threads": 64,
    "hostname": "",
    "kernel": "",
    "os": "",
    "cpu": "",
    "cpu_sockets": 0,
    "cpu_cores_per_socket": 0,
    "cpu_threads_per_core": 0,
    "cpu_count_logical": 0,
    "numa_nodes": 0,
    "smt_active": false,
    "cpu_governor": "",
    "mem_total_kb": 0,
    "glibc": "",
    "gcc": "",
    "python": "",
    "iqtree_binary": "/scratch/pawsey1351/asamuel/iqtree3/build-profiling/iqtree3",
    "iqtree_version": "",
    "date": "",
    "slurm": {
      "job_id": "42179044",
      "job_name": "iq-large_modelfinder-64t",
      "partition": "work",
      "account": "pawsey1351",
      "nodelist": "nid001785",
      "num_nodes": "1",
      "cpus_per_task": "128",
      "ntasks": "1",
      "mem_per_node": "235520",
      "submit_host": "nid002808",
      "submit_dir": "/scratch/pawsey1351/asamuel/iqtree3"
    }
  },
  "profile": {
    "dataset": "large_modelfinder.fa",
    "threads": 64,
    "perf_cmd": "srun --cpus-per-task=64 --cpu-bind=cores --hint=nomultithread numactl --localalloc /scratch/pawsey1351/asamuel/iqtree3/build-profiling/iqtree3 -s /scratch/pawsey1351/asamuel/iqtree3/benchmarks/large_modelfinder.fa -T 64 -seed 1 --prefix /scratch/pawsey1351/asamuel/iqtree3/setonix-ci/profiles/large_modelfinder_64t_smtoff_pin_42179044/iqtree_run",
    "metrics": {
      "cycles": 83237779,
      "instructions": 357191893,
      "branch-instructions": 63002110,
      "branch-misses": 473177,
      "cache-references": 2394555,
      "cache-misses": 311913,
      "L1-dcache-loads": 71590435,
      "L1-dcache-load-misses": 940531,
      "dTLB-loads": 357975,
      "dTLB-load-misses": 12949,
      "iTLB-loads": 5674,
      "iTLB-load-misses": 4597,
      "stalled-cycles-frontend": 6896341,
      "page-faults": 2052,
      "context-switches": 0,
      "cpu-migrations": 0,
      "ex_ret_ops": 165485876,
      "ex_ret_brn_misp": 41325,
      "IPC": 4.291223255728628,
      "cache-miss-rate": 13.0259,
      "branch-miss-rate": 0.751,
      "L1-dcache-miss-rate": 1.3138,
      "dTLB-miss-rate": 3.6173,
      "iTLB-miss-rate": 81.0187,
      "frontend-stall-rate": 8.2851,
      "L1d-mpki": 2.6331252708470627,
      "cache-miss-mpki": 0.873236504278668,
      "cache-ref-mpki": 6.703833560970545,
      "cache_level": "L2",
      "l2-miss-rate": 13.0259,
      "l2-miss-mpki": 0.873236504278668,
      "frontend-stall-unit": "cycles",
      "frontend-stall-max-pct": 100.0
    }
  },
  "summary": {
    "pass": 0,
    "fail": 0,
    "total_time": 0.0,
    "all_pass": true
  },
  "dataset_info": {
    "file": "large_modelfinder.fa",
    "file_size_bytes": 5001200,
    "fasta_taxa": 100,
    "fasta_sites": 50000,
    "sha256": "73908728537994a4ad43a3a8dfd8b7b736d2578fe0276a617e71848e15b01207",
    "path": "/scratch/pawsey1351/asamuel/iqtree3/benchmarks/large_modelfinder.fa"
  }
}
